user_id,text,gender_label,clean_text
1,I love shopping for new shoes and makeup!,female,i love shopping new shoes makeup
2,Watching the football match with my buddies tonight.,male,watching football match my buddies tonight
3,Just bought a new laptop for coding projects.,male,bought new laptop coding projects
4,Excited for the skincare routine I started.,female,excited skincare routine i started
5,"Coffee, code, repeat. Life is good.",male,coffee code repeat life good
6,Baking cookies for my family this weekend!,female,baking cookies my family weekend
